{
  "intent_spec": {
    "intent_name": "extraction_and_trajectory_smoke",
    "intent_spec_version": "1.0.0",
    "evaluation_goal": "Evaluate email extraction and trajectory tool-use.",
    "target_domain": ["extraction", "trajectory"],
    "capability_focus": ["extraction", "trajectory"],
    "batch_size": 6,
    "defaults": { "seed": 42, "max_prompt_length": 20000, "max_retries_per_stage": 2 }
  },
  "eval_families": [
    {
      "family_id": "extraction.email",
      "family_label": "Email extraction",
      "objective": "Extract email address from text.",
      "observable_targets": ["email"],
      "grounding_mode": "synthetic",
      "allowed_eval_methods": ["exact_match", "schema_check", "rubric_judge"],
      "difficulty": "easy",
      "risk_tier": "default",
      "slot_weight": 10,
      "materializer_type": "json_extract_email",
      "materializer_config": {},
      "dedup_group": "extraction.email",
      "failure_taxonomy": ["EXACT_MATCH_FAILED"]
    },
    {
      "family_id": "trajectory.email_lookup",
      "family_label": "Trajectory: email lookup then answer",
      "objective": "Use search_email_db tool then return email.",
      "observable_targets": ["email", "trajectory"],
      "grounding_mode": "synthetic",
      "allowed_eval_methods": ["trajectory_check", "schema_check", "rubric_judge"],
      "difficulty": "easy",
      "risk_tier": "default",
      "slot_weight": 10,
      "materializer_type": "trajectory_email_then_answer",
      "materializer_config": {},
      "dedup_group": "trajectory.email_lookup",
      "failure_taxonomy": ["TRAJECTORY_CHECK_FAILED"]
    }
  ],
  "prompt_blueprints": [
    {
      "blueprint_id": "bp_extraction_email_easy",
      "family_id": "extraction.email",
      "blueprint_type": "json_extract_email",
      "instruction_template": "",
      "input_schema": {},
      "output_schema": {},
      "variation_axes": ["difficulty", "domain"],
      "grounding_recipe": { "mode": "synthetic" },
      "constraints": [],
      "negative_constraints": [],
      "dedup_fingerprint_fields": ["task_type", "difficulty", "domain_tags"],
      "materializer_type": "json_extract_email",
      "materializer_config": {}
    },
    {
      "blueprint_id": "bp_trajectory_email_lookup_easy",
      "family_id": "trajectory.email_lookup",
      "blueprint_type": "trajectory_email_then_answer",
      "instruction_template": "",
      "input_schema": {},
      "output_schema": {},
      "variation_axes": ["difficulty", "domain"],
      "grounding_recipe": { "mode": "synthetic" },
      "constraints": [],
      "negative_constraints": [],
      "dedup_fingerprint_fields": ["task_type", "difficulty", "domain_tags"],
      "materializer_type": "trajectory_email_then_answer",
      "materializer_config": {}
    }
  ],
  "judge_specs": [
    {
      "judge_spec_id": "judge_extraction_email",
      "family_id": "extraction.email",
      "blueprint_id": "bp_extraction_email_easy",
      "eval_method": "exact_match",
      "checker_name": null,
      "checker_config": null,
      "expected_shape": {},
      "canonicalization_rules": [],
      "pass_fail_observables": ["email"],
      "evidence_requirements": null,
      "adjudication_policy": "strict",
      "failure_taxonomy": ["EXACT_MATCH_FAILED"],
      "method_justification": "Selected exact_match for family extraction.email (observables: ['email']); strongest machine-checkable method for observable targets."
    },
    {
      "judge_spec_id": "judge_trajectory_email_lookup",
      "family_id": "trajectory.email_lookup",
      "blueprint_id": "bp_trajectory_email_lookup_easy",
      "eval_method": "trajectory_check",
      "checker_name": null,
      "checker_config": null,
      "expected_shape": {},
      "canonicalization_rules": [],
      "pass_fail_observables": ["email", "trajectory"],
      "evidence_requirements": null,
      "adjudication_policy": "strict",
      "failure_taxonomy": ["TRAJECTORY_CHECK_FAILED"],
      "method_justification": "Selected trajectory_check for family trajectory.email_lookup (observables: ['email', 'trajectory']); strongest machine-checkable method for observable targets."
    }
  ],
  "compiled_dataset_spec": {
    "dataset_name": "intent_extraction_and_trajectory_smoke_1.0.0",
    "dataset_spec_version": "1.0.0",
    "allowed_domain_tags": ["extraction", "trajectory"],
    "capability_targets": [
      {
        "target_id": "t_extraction_email_easy",
        "domain_tags": ["extraction", "trajectory"],
        "difficulty": "easy",
        "task_type": "json_extract_email",
        "quota_weight": 10,
        "family_id": "extraction.email",
        "blueprint_id": "bp_extraction_email_easy",
        "judge_spec_id": "judge_extraction_email",
        "materializer_config": {}
      },
      {
        "target_id": "t_trajectory_email_lookup_easy",
        "domain_tags": ["extraction", "trajectory"],
        "difficulty": "easy",
        "task_type": "trajectory_email_then_answer",
        "quota_weight": 10,
        "family_id": "trajectory.email_lookup",
        "blueprint_id": "bp_trajectory_email_lookup_easy",
        "judge_spec_id": "judge_trajectory_email_lookup",
        "materializer_config": {}
      }
    ],
    "defaults": {
      "seed": 42,
      "max_prompt_length": 20000,
      "max_retries_per_stage": 2
    }
  },
  "compile_metadata": {
    "intent_spec_version": "1.0.0",
    "family_catalog_version": "1.0.0",
    "blueprint_schema_version": "1.0.0",
    "judge_spec_schema_version": "1.0.0",
    "planner_version": "1.0.0",
    "compiler_version": "1.0.0",
    "compiled_at": "2025-03-08T12:00:00Z",
    "warnings": []
  }
}
